{
  "corpus": "united_states_code",
  "files": [
    {
      "chapter": "1",
      "citation": "11 U.S.C. § 101",
      "file_hash": "b44ed5be0d4a464d69b1420cb8e399b1a385f4cff8434b028e142bbead1c8b8e",
      "path": "legal/us/code/title-11/chapter-1/section-101.md",
      "section": "101",
      "source_hash": "9766f26260cfe4eaac8cc151959f439dd1d21e19fdce59eca130149a77548928",
      "source_identifier": "/us/usc/t11/s101",
      "text_hash": "f857fe6c92056afcbf7d0751bb811625a6f8f0db2af727caaea2ced891f89efc"
    },
    {
      "chapter": "1",
      "citation": "11 U.S.C. § 102",
      "file_hash": "38eb943dbfbf43d57761607c6f9a30950b55d3c291d037d466f614267804cf7a",
      "path": "legal/us/code/title-11/chapter-1/section-102.md",
      "section": "102",
      "source_hash": "48b778743890022aa1b6d9d580a505a13fdaffb0ee6104415430bfb2336ea95c",
      "source_identifier": "/us/usc/t11/s102",
      "text_hash": "79c0debaa32cef5da9ea9dbd054de52755e9610d2a7403ee0622c23d391c5b31"
    },
    {
      "chapter": "1",
      "citation": "11 U.S.C. § 103",
      "file_hash": "108832cd96d0b57acb0ed950ed4bc1b7e899d808dd17bf76360505bad2bdcf3d",
      "path": "legal/us/code/title-11/chapter-1/section-103.md",
      "section": "103",
      "source_hash": "6127ce53afe4bbb978692fcab16a7aa8210b3d95d3ffe135099d89fd5745d082",
      "source_identifier": "/us/usc/t11/s103",
      "text_hash": "16e1964b2dbf737b157ec31573fec829ebdcc010f59b311fb28bc40b890011e9"
    },
    {
      "chapter": "1",
      "citation": "11 U.S.C. § 104",
      "file_hash": "43ea9b2a3c3a36d0276290a782f58a741f34a7e334b01efb588a4b0bbf5176e1",
      "path": "legal/us/code/title-11/chapter-1/section-104.md",
      "section": "104",
      "source_hash": "582d05fb6c3948fcf1697c0ac2efa23ff1fc42643defc234d0d48a81cbc15cb5",
      "source_identifier": "/us/usc/t11/s104",
      "text_hash": "c64dd16ca555f498565d5d1b964b5831f834a45f1c3384291a445afd73084483"
    },
    {
      "chapter": "1",
      "citation": "11 U.S.C. § 105",
      "file_hash": "61d235cc006f1686c98f1c585dbec58d1ba7e0daffa4ab0f63ab512b18eedd15",
      "path": "legal/us/code/title-11/chapter-1/section-105.md",
      "section": "105",
      "source_hash": "67b72af0d2be3057b7dbed5ee0671e777ca7ebbb7a479c6ed69395be371cd87b",
      "source_identifier": "/us/usc/t11/s105",
      "text_hash": "dd68197948ee7bfb98227d47ca2530a7ec17109126a54f755de8b595ba4f3c32"
    },
    {
      "chapter": "1",
      "citation": "11 U.S.C. § 106",
      "file_hash": "219cd5e5598fc558d73a248765e7012980efd32f26049f67ac639459e2a617c7",
      "path": "legal/us/code/title-11/chapter-1/section-106.md",
      "section": "106",
      "source_hash": "a90ec9d55cbe976e64880d683532486850843c507a11684009ec5e5e2004c9b0",
      "source_identifier": "/us/usc/t11/s106",
      "text_hash": "87ff4bb4e56e532cb37823f119bafcf96f82200356657610643b6af4455db0ca"
    },
    {
      "chapter": "1",
      "citation": "11 U.S.C. § 107",
      "file_hash": "3321ebf446e7bebb3fcb648e33144c186ab60e9ec93151e82431b6135293f36e",
      "path": "legal/us/code/title-11/chapter-1/section-107.md",
      "section": "107",
      "source_hash": "32d284081eb73198f9c2bdacfa1261ac4d6d8fdb1db990dd60db8ff2641f8557",
      "source_identifier": "/us/usc/t11/s107",
      "text_hash": "025ea6df1cef8f37787f761e0574ce873a22f7d82de187a83b6221b51c914c86"
    },
    {
      "chapter": "1",
      "citation": "11 U.S.C. § 108",
      "file_hash": "27da8a86415ed541a1f61c435095d8e815fb4c190cb2cc0f585daf5b097670c3",
      "path": "legal/us/code/title-11/chapter-1/section-108.md",
      "section": "108",
      "source_hash": "9dba778e9f2e17d0ed6310abe4baa2c58da6af981133d1af12f13fd809738ee3",
      "source_identifier": "/us/usc/t11/s108",
      "text_hash": "704aa0182200ec920b377b54ca5c3f3d807a474e22a1ccff83d6057eac96a980"
    },
    {
      "chapter": "1",
      "citation": "11 U.S.C. § 109",
      "file_hash": "e505ed7de3a3e2354a7bf7d463f104fc75be3b7ccb1330d7d971d6b76dd964d2",
      "path": "legal/us/code/title-11/chapter-1/section-109.md",
      "section": "109",
      "source_hash": "34e2389432281754b605e182d5260ed1402da1a00df3285cbe2a96f8392a1290",
      "source_identifier": "/us/usc/t11/s109",
      "text_hash": "58c4bcf4b11d15cb8abbcff20b96a738f047f95eb918a4796591c849c1ca3ac8"
    },
    {
      "chapter": "1",
      "citation": "11 U.S.C. § 110",
      "file_hash": "1ae18f2622d45d41abfebbbcc2632eb16ef64b3236f9f1f28a753a1a8dc67f94",
      "path": "legal/us/code/title-11/chapter-1/section-110.md",
      "section": "110",
      "source_hash": "6032c110dd97f6bb92e063be4b0ebce5efc36580c6f814d3e6fff051eed51076",
      "source_identifier": "/us/usc/t11/s110",
      "text_hash": "9851bfdbbac984212fb3b9160fb321faeff6d8bd9312a6d10cdb883d13d47af3"
    },
    {
      "chapter": "11",
      "citation": "11 U.S.C. § 1101",
      "file_hash": "0fcaf9a364c2cc26639f331a5b5234f6d4ab30732fe36bf926e4e466e694e7ac",
      "path": "legal/us/code/title-11/chapter-11/section-1101.md",
      "section": "1101",
      "source_hash": "b27a3bc436505d59ca3b9257632c00c8882a55e0230f17375d5a552e5b902f9c",
      "source_identifier": "/us/usc/t11/s1101",
      "text_hash": "22addbfce9e4f919630ad95f7f5834155382301841fa4f509ffa0dec3cd30de4"
    },
    {
      "chapter": "11",
      "citation": "11 U.S.C. § 1102",
      "file_hash": "d6ca81662ed23baee16775a032141970aed44756fbbc0068ffcf532ecfcfa8ab",
      "path": "legal/us/code/title-11/chapter-11/section-1102.md",
      "section": "1102",
      "source_hash": "618851dc24e34517005b8e6c2137de89efb2d025ff4e21314119df02611377ac",
      "source_identifier": "/us/usc/t11/s1102",
      "text_hash": "14058c20ab51590902b53b39bcaeaa7caddc9f499df52db4e051ad89f4befca2"
    },
    {
      "chapter": "11",
      "citation": "11 U.S.C. § 1103",
      "file_hash": "d0896e1722ca5a65424543d1972e943a7ab1cdfd09407c0cea517e866878868a",
      "path": "legal/us/code/title-11/chapter-11/section-1103.md",
      "section": "1103",
      "source_hash": "49d8f4cb527390d1165f4f7b0abc83fa61b7bb4f14117bdbe5c80e08eb1b3c52",
      "source_identifier": "/us/usc/t11/s1103",
      "text_hash": "85640cc15666b5851949d2a66cbf4007fbed535bced1db0cc997941e287dda5a"
    },
    {
      "chapter": "11",
      "citation": "11 U.S.C. § 1104",
      "file_hash": "cf49a8f093e6bf03f6564004001d4ca22f7bd8bb7aaa78ac9f3a6b49eeb82404",
      "path": "legal/us/code/title-11/chapter-11/section-1104.md",
      "section": "1104",
      "source_hash": "cab5f7ecc70e1ec2a6437d94ee59d92e5d84f73b74783fbd715bcf6b2a939569",
      "source_identifier": "/us/usc/t11/s1104",
      "text_hash": "28c6e1a514f404f4df4f8dc8a28a6afe23fc671e072b8a06294c49d1c334884f"
    },
    {
      "chapter": "11",
      "citation": "11 U.S.C. § 1105",
      "file_hash": "0aac4d0691028bdfcf55ae0338c8d6329f91ef8fbaae3ac8a4d2edfdad343da4",
      "path": "legal/us/code/title-11/chapter-11/section-1105.md",
      "section": "1105",
      "source_hash": "1496679f940e9f831a03cd0cea3b9e54332244a277a2a723276e189b9826847e",
      "source_identifier": "/us/usc/t11/s1105",
      "text_hash": "e79b2229f2de8871aa7f232b3dc2d1014fab46762c34babb5060a3da62e6e78a"
    },
    {
      "chapter": "11",
      "citation": "11 U.S.C. § 1106",
      "file_hash": "c4a7d43b8baccea194ba01878f53b2ef4b0c1b5a27ab3b5726e2cc108ac0283f",
      "path": "legal/us/code/title-11/chapter-11/section-1106.md",
      "section": "1106",
      "source_hash": "7e8a27784f51830833ddceb14f55d899bb7d7b4a25184f977f30fe91e18839f4",
      "source_identifier": "/us/usc/t11/s1106",
      "text_hash": "1fe15ee5e11f43835223b1b2bb576eed120fef16fff4fed3839425b2f029a90b"
    },
    {
      "chapter": "11",
      "citation": "11 U.S.C. § 1107",
      "file_hash": "bf707dd72634c19152506e6ab6aa2276591ab55f885d38b2da798a30a6a10568",
      "path": "legal/us/code/title-11/chapter-11/section-1107.md",
      "section": "1107",
      "source_hash": "d5de83eb029ff5b0f6b4a5821a3b859384f4184f3080fb7758d97e3046f0d036",
      "source_identifier": "/us/usc/t11/s1107",
      "text_hash": "69daff3f13dadb213e68f102c61b7c84d6ca4f9eac19047ae10e3dc0226c8bf5"
    },
    {
      "chapter": "11",
      "citation": "11 U.S.C. § 1108",
      "file_hash": "b0638603422ff61b5f26abf20e67d012a326d7989d919c0362a6c405e73a54d9",
      "path": "legal/us/code/title-11/chapter-11/section-1108.md",
      "section": "1108",
      "source_hash": "497f0b3ed2b7f1edc10846c8578acdf0e2c775df9526fbfc9052736b474d7c9c",
      "source_identifier": "/us/usc/t11/s1108",
      "text_hash": "1b8ad75a29df0226d76a40dae9dbd1123f12379fbba553e8fd9661132e3cab6c"
    },
    {
      "chapter": "11",
      "citation": "11 U.S.C. § 1109",
      "file_hash": "ed64da1ddc449b2d7d6e23133354fd0f15103c20415798427f9f6a6fc3c3990f",
      "path": "legal/us/code/title-11/chapter-11/section-1109.md",
      "section": "1109",
      "source_hash": "f9d5be28462117c564bb81aeaa37013533b1615fd6efd7b7226fd80c993b67b8",
      "source_identifier": "/us/usc/t11/s1109",
      "text_hash": "702ef3b45d4a3b709e8b8d20b78999a6aef11116953cc5ca8709f69d5ffbe5ec"
    },
    {
      "chapter": "1",
      "citation": "11 U.S.C. § 111",
      "file_hash": "1cd8cd07c66463e67bb1d3d5bbdaed55f00e1f0bd4f32cbf87a39f36c6847dc7",
      "path": "legal/us/code/title-11/chapter-1/section-111.md",
      "section": "111",
      "source_hash": "67a1948ee513ba01cfadd2ccca163c066a20c967a1a95744d62837e069d111d3",
      "source_identifier": "/us/usc/t11/s111",
      "text_hash": "f6e6276ae6e8ac289f50e99cbdf6b21c158603a761b8ed789e4134f633a06565"
    },
    {
      "chapter": "11",
      "citation": "11 U.S.C. § 1110",
      "file_hash": "83f6585f8f8f44a8189418a73b0b4fbc399620480c0dad8f9b15d33c840041cb",
      "path": "legal/us/code/title-11/chapter-11/section-1110.md",
      "section": "1110",
      "source_hash": "0a74346c00fcab58e8cbd501f3a64910eab313f15a159c4d594e1fca004df0ab",
      "source_identifier": "/us/usc/t11/s1110",
      "text_hash": "a619701198278f8963fea243bffddd847e0ad9e0784ee45fc929e45e0208c326"
    },
    {